{
  "timestamp": "2026-03-31T00:00:00Z",
  "summary": "Repository initialization and audit completed. V5.0 established.",
  "working_on": {
    "feature": "V5.0 Initial Release",
    "status": "deploying",
    "notes": "Base structure established with .brain tracking."
  },
  "progress": {
    "completed": ["Version Unification", "Phantom Path Cleanup", "Schema Alignment"],
    "in_progress": [],
    "remaining": [],
    "percentage": "100"
  }
}
